{
  "proposal_id": "migration-history-divergence-remediation-proposal-v5",
  "extends_proposal_id": "migration-history-divergence-remediation-proposal-v4",
  "status": "POLICY_ONLY_NOT_APPROVED",
  "operational_authorization": false,
  "next_stage_authorized": false,
  "source_only": true,
  "catalog_migration_created": false,
  "anchors": {
    "v4_proposal_sha256": "92b1c33ab3e2cd0a6c9b5ad486a317c229d7aefc7c60da88913716d58345e6ac",
    "v4_schema_sha256": "e10d8922a68a6f475191330dbecf0c00b2e5ffccf03e9fb4726bdcb30c4d494f",
    "v4_verifier_sha256": "3cb09957b283b254bb88b97456e065a18f390d707fcbd77c71530f8052266af3",
    "intent_v2_sha256": "ed88e94768d00d4c874005bcefa58489699c09445193c0e0db6b53d9ccb66bf9",
    "author_sha256": "a32ba4e92aabfa38e7b8a4cad5ce0682e387fad61f67351ca08568cca8719c48",
    "replay_sha256": "bfe5e8dea591a9b3085b5d19ebac70ddcc8d48937dce9dd76289f00ecdbabd8f",
    "tests_sha256": "667fe23cc1ecfd05a535d71de4d1ada7f65986bc8739335779ca0363884213f9",
    "v5_schema_sha256": "474d0c38b8a630284232e3002c469a9a09a9a4d203b7d5009100c233143ddf97",
    "v5_verifier_sha256": "d200da14d3d287840ccae7a8a2cef75ad03c69737a58417f673e91dd17d1090a",
    "workflow_sha256": "365ce034f769480278cf08636081d7250adeb56e7d29d70feaf1572e0cbd715b"
  },
  "private_runtime": {
    "intent_artifact_id": "migration-authoring-intent-v2",
    "intent_prefix": "PASTORAI_MIGRATION_INTENT_V2",
    "scope": "PRIVATE_RUNTIME",
    "authoring_script": "backend/scripts/new_private_runtime_migration.py",
    "replay_script": "backend/scripts/replay_private_runtime_migration_pg17.py",
    "replay_implemented": false,
    "pg17_evidence": false,
    "cross_tenant_evidence": false,
    "policy_directory": "docs/governance/migrations/private-runtime",
    "schema": "agent_private",
    "runtime_role": "agent_runtime",
    "tenant_function": "agent_private.current_tenant_id()",
    "helper_function_security": "SECURITY INVOKER",
    "projection_function": "agent_private.load_turn_context(uuid)",
    "projection_function_security": "SECURITY DEFINER",
    "function_volatility": "STABLE",
    "helper_function_search_path": ["pg_catalog"],
    "projection_function_search_path": ["pg_catalog", "agent_private"],
    "direct_public_grants_allowed": false,
    "runtime_write_privileges_allowed": false,
    "memberships_allowed": false,
    "gates": {
      "operational_authorization": false,
      "next_stage_authorized": false
    }
  }
}
